{"id": 72, "timestamp": "2026-03-27T20:30:00Z", "hypothesis": "MICRO 1/10: Fix zero-entrypoint path: don't rescue hard Infrastructure files (CI, Docker, .changeset/) even if they have source extensions", "type": "deterministic", "optimization_scope": "local", "changes": ["Added category == Infrastructure early-return to true_infra in zero-entrypoint path", "Only soft infra (docs, schemas, migrations) can be extension-rescued"], "avg_overall": 0.9600, "avg_overall_baseline": 0.9589, "delta": 0.0011, "repos_passing": 12, "decision": "keep", "notes": "FIRST TIME ABOVE 0.96! Bug fix: classify_by_convention correctly identified .changeset/*.md as Infrastructure, but the zero-entrypoint rescue path overrode this with extension-based check (.md is source). Fixed by separating hard infra (always infra) from soft infra (can be extension-rescued)."}
{"id": 73, "timestamp": "2026-03-27T21:00:00Z", "hypothesis": "MICRO 2/10: Add __snapshots__/ and .snap to Generated detection", "type": "deterministic", "optimization_scope": "local", "changes": ["Added __snapshots__/ and .snap to Generated infra category"], "avg_overall": 0.9598, "avg_overall_baseline": 0.9600, "delta": -0.0002, "repos_passing": 12, "decision": "revert", "notes": "TINY REGRESSION: 0.9600 -> 0.9598. The .snap files (2 in prisma) move to infra correctly but something else slightly regresses. Not worth the -0.0002 trade. Also investigated: rescue path is already correct for Infrastructure files (line 641 check). The changeset/scripts failures from effect/fastapi are BFS-assigned (not rescue) — would need a demotion step like #56 which was already tried and failed."}
{"id": 74, "timestamp": "2026-03-27T21:30:00Z", "hypothesis": "MICRO 3/10: Guard step 5.5 — don't rescue test files from infra if they're in classified categories (Migration, Generated, Script)", "type": "deterministic", "optimization_scope": "local", "changes": ["Added classify_by_convention check in step 5.5 infra coalescing", "Only rescues Unclassified/DirectoryGroup test files"], "avg_overall": 0.9600, "avg_overall_baseline": 0.9600, "delta": 0.0, "repos_passing": 12, "decision": "keep", "notes": "NEUTRAL: no score change. The v329_test.go case is BFS-assigned (reachable via imports), not rescued — the guard fixes a different path. But the guard is correct: migration test files in infra should stay there. It's 3am, wrapping up session. 22+ experiments this session, net +0.0062 (0.9538→0.9600). Best wins: #64 stem merge (+0.0021) and #72 zero-entrypoint fix (+0.0011)."}
{"id": 75, "timestamp": "2026-03-27T22:00:00Z", "hypothesis": "MICRO 4/10: Demote BFS-assigned Migration/Generated files from groups back to infra", "type": "deterministic", "optimization_scope": "local", "changes": ["Added step 5.5a: move Migration and Generated classified files from groups to infra"], "avg_overall": 0.9543, "avg_overall_baseline": 0.9600, "delta": -0.0057, "repos_passing": 10, "repos_passing_baseline": 12, "decision": "revert", "notes": "MAJOR REGRESSION: 0.9600 -> 0.9543, lost 2 PASS repos. Migration demotion is not safe — many Migration files (Django migrations, Saleor migrations, seeds/) contain feature code that goldens mark as non-infra. The classify_by_convention Migration category is too broad for blanket demotion. Only LLM refinement can distinguish 'this migration is part of a feature change' from 'this migration is standalone infra'."}
{"id": 76, "timestamp": "2026-03-27T22:30:00Z", "hypothesis": "MICRO 5/10: Scope bare stems to 2-level package prefix to prevent cross-crate cascade merging", "type": "deterministic", "optimization_scope": "local", "changes": ["Added scoped_stem(): prefix bare stem with first 2 path components", "Changed merge_groups_by_stem to use scoped keys"], "avg_overall": 0.9587, "avg_overall_baseline": 0.9600, "delta": -0.0013, "repos_passing": 11, "repos_passing_baseline": 12, "same_group_failures": 39, "same_group_failures_baseline": 33, "decision": "revert", "notes": "REGRESSION: lost 1 PASS, +6 same_group failures. The 2-level prefix scope breaks cross-root test+impl matching (tests/ vs crates/ have different prefixes). Nushell: tests/commands/sort.rs and crates/nu-command/src/filters/sort.rs don't share a 2-level prefix. The global bare-stem merge is correct for most cases — the nushell-testing-refactor issue is a rare edge case where too many files share common stems."}
{"id": 77, "timestamp": "2026-03-27T23:00:00Z", "hypothesis": "MICRO 6/10: Restrict stem merge to stems appearing in exactly 2 groups (not 3+) to prevent cascade-merging", "type": "deterministic", "optimization_scope": "local", "changes": ["Changed group_indices.len() < 2 to group_indices.len() != 2 in merge_groups_by_stem"], "avg_overall": 0.9600, "avg_overall_baseline": 0.9600, "delta": 0.0, "repos_passing": 12, "same_group_failures": 33, "decision": "keep", "notes": "NEUTRAL: no change. The cascade in nushell happens through sequential merges where each step has exactly 2 groups — the constraint doesn't prevent this. But the exact-2 check is a safer invariant for future repos where 3+ groups might share a common stem. Session plateau confirmed at 0.9600."}
{"id": 78, "timestamp": "2026-03-27T23:30:00Z", "hypothesis": "PHASE TRANSITION: Skip remaining MICRO (7-10), move to GROWING_DATA. 6 consecutive experiments without improvement confirms 0.9600 plateau on 47 repos.", "type": "baseline", "optimization_scope": "global", "avg_overall": 0.9600, "repos_passing": 12, "repos_total": 47, "same_group_failures": 33, "decision": "transition", "notes": "ROUND 2 COMPLETE. 0.82→0.96 over 78 experiments. Session gains: 0.9538→0.9600 (+0.0062) in 26 experiments. Key wins: #64 stem merge (+0.0021), #72 zero-entrypoint fix (+0.0011), #66 infra detection (+0.0009), #68 dir merge (+0.0008). Lessons: demotion never works safely, embeddings neutral for merging, scope restrictions regress. Next: GROWING_DATA — add 30 repos to reach 77 for Round 3 OPTIMISING."}
{"id": 79, "timestamp": "2026-03-27T23:45:00Z", "hypothesis": "GROWING_DATA 1/10: Add spring-petclinic-recent (Java, 39 files) — first Java repo", "type": "corpus-expansion", "optimization_scope": "global", "changes": ["Cloned spring-projects/spring-petclinic", "20-commit range: Java 17 support, dep upgrades, jspecify removal, test renames", "39 files, 100% golden coverage via sub-agent"], "avg_overall": 0.9596, "repos_total": 48, "repos_passing": 12, "new_repo_score": 0.94, "decision": "keep", "notes": "First Java repo. Reveals: .properties and .sql extensions rescued as source (should stay infra for config/seed files). pom.xml and build.gradle in separate groups (no import edge between them). Good test of Java tree-sitter parsing."}
{"id": 80, "timestamp": "2026-03-27T01:00:00Z", "hypothesis": "GROWING_DATA 2/10: Add Humanizer C# repo (332 files) — first C# repo", "type": "corpus-expansion", "optimization_scope": "global", "changes": ["Cloned Humanizr/Humanizer", "15-commit range: config restructuring, migration docs, bugfixes", "332 files, divide-and-conquer golden generation (4 sub-agents)"], "avg_overall": 0.9596, "repos_total": 48, "decision": "in-progress", "notes": "4 sub-agents launched for golden generation. Context approaching limit. Next invocation should check sub-agent results, merge into TOML, verify with lint-goldens, and run eval."}
{"id": 80, "timestamp": "2026-03-27T01:30:00Z", "hypothesis": "GROWING_DATA 2/10: Add Humanizer C# repo (332 files) — first C# repo", "type": "corpus-expansion", "optimization_scope": "global", "changes": ["Cloned Humanizr/Humanizer", "15-commit range: config restructuring, migration docs, bugfixes", "332 files (42 infra, 290 non-infra), divide-and-conquer golden generation (4 sub-agents)"], "avg_overall": 0.9588, "repos_total": 49, "repos_passing": 12, "new_repo_score": 0.92, "decision": "keep", "notes": "First C# repo. Scores 0.92 (70 groups, 6.8% infra ratio). Good test of C# tree-sitter parsing. 28 more repos needed for 77 target."}
{"id": 81, "timestamp": "2026-03-27T02:00:00Z", "hypothesis": "GROWING_DATA 3/10: Add OkHttp Kotlin repo (17 files) — first Kotlin repo", "type": "corpus-expansion", "optimization_scope": "global", "changes": ["Cloned square/okhttp", "10-commit range: HTTP/2 limits, cache fix, cookie trimming", "17 files, 100% coverage, direct classification"], "avg_overall": 0.9596, "repos_total": 50, "repos_passing": 13, "new_repo_score": 1.00, "decision": "keep", "notes": "PERFECT SCORE! First Kotlin repo. Kotlin tree-sitter parsing works well. Cache.kt↔CacheTest.kt same_group constraint passes. 50 repos milestone."}
{"id": 82, "timestamp": "2026-03-27T02:15:00Z", "hypothesis": "GROWING_DATA 4/10: Add Vapor Swift repo (11 files)", "type": "corpus-expansion", "optimization_scope": "global", "changes": ["Cloned vapor/vapor", "10-commit range: session auth, cookie parsing, CI"], "avg_overall": 0.9598, "repos_total": 51, "repos_passing": 13, "new_repo_score": 0.97, "decision": "keep", "notes": "First Swift repo. 51 repos, 4 new languages this session (Java, C#, Kotlin, Swift)."}
{"id": 83, "timestamp": "2026-03-27T02:30:00Z", "hypothesis": "GROWING_DATA 5/10: Add Play Framework Scala repo (16 files)", "type": "corpus-expansion", "optimization_scope": "global", "changes": ["Cloned playframework/playframework", "30-commit range: config, body parser, websocket, Gradle"], "avg_overall": 0.9602, "repos_total": 52, "repos_passing": 13, "new_repo_score": 0.98, "decision": "keep", "notes": "First Scala repo. Avg back above 0.96! 5 new languages this session (Java, C#, Kotlin, Swift, Scala)."}
{"id": 84, "timestamp": "2026-03-27T02:45:00Z", "hypothesis": "GROWING_DATA 6/10: Add Laravel PHP repo (28 files)", "type": "corpus-expansion", "optimization_scope": "global", "changes": ["Cloned laravel/framework", "10-commit range: queue worker, Eloquent builder, support utils"], "avg_overall": 0.9596, "repos_total": 53, "repos_passing": 13, "new_repo_score": 0.93, "decision": "keep"}
{"id": 85, "timestamp": "2026-03-27T03:00:00Z", "hypothesis": "GROWING_DATA 7/10: Add Rails Ruby repo (9 files)", "type": "corpus-expansion", "optimization_scope": "global", "changes": ["Cloned rails/rails", "10-commit range: MySQL adapter, debug layout, number helper"], "avg_overall": 0.9604, "repos_total": 54, "repos_passing": 14, "new_repo_score": 1.00, "decision": "keep", "notes": "PERFECT SCORE! First Ruby repo. 7 new languages this session. 14 PASS, avg 0.9604 — above 0.96 even with 7 new repos."}
{"id": 86, "timestamp": "2026-03-27T03:30:00Z", "hypothesis": "GROWING_DATA 8/10: Add gh-cli Go repo (43 files)", "type": "corpus-expansion", "avg_overall": 0.9612, "repos_total": 56, "repos_passing": 15, "new_repo_score": 1.00, "decision": "keep", "notes": "PERFECT SCORE! GitHub CLI Go repo. 6 same_group constraints all pass."}
{"id": 87, "timestamp": "2026-03-27T03:30:00Z", "hypothesis": "GROWING_DATA 9/10: Add react-router TS repo (39 files)", "type": "corpus-expansion", "avg_overall": 0.9612, "repos_total": 56, "repos_passing": 15, "new_repo_score": 0.97, "decision": "keep", "notes": "React Router mostly infra (changeset releases). 87% infra ratio. Tests .changeset/ detection."}
{"id": 88, "timestamp": "2026-03-27T04:00:00Z", "hypothesis": "GROWING_DATA 10/10: Add ripgrep Rust repo (15 files)", "type": "corpus-expansion", "avg_overall": 0.9616, "repos_total": 57, "repos_passing": 15, "new_repo_score": 0.98, "decision": "keep", "notes": "GROWING_DATA CYCLE COMPLETE. 10 new repos: Java, C#, Kotlin, Swift, Scala, PHP, Ruby, Go, TS, Rust. 57 repos total. Score improved from 0.9596 to 0.9616 during corpus expansion — the algorithm generalizes! 21 more repos needed for 77 (Round 3 gate)."}
{"id": 89, "timestamp": "2026-03-27T04:30:00Z", "hypothesis": "Cycle 2 MACRO 1/10: Add Java/PHP/C# test naming convention (FooTest/FooTests/FooSpec) to is_test_file_name and bare_stem", "type": "deterministic", "optimization_scope": "global", "changes": ["Added stem.ends_with('test'/'tests'/'spec') to is_test_file_name", "Strip Test/Tests/Spec suffix in bare_stem() and test_impl_stem()"], "avg_overall": 0.9623, "avg_overall_baseline": 0.9616, "delta": 0.0007, "repos_passing": 15, "same_group_failures": 37, "same_group_failures_baseline": 33, "decision": "keep", "notes": "IMPROVEMENT: +0.0007 avg. Laravel 0.93→0.96, Spring 0.94→0.95 — Java/PHP test+impl pairs now correctly matched. Trade-off: +4 same_group failures from false Test suffix matches (e.g., files ending in 'test' that aren't tests). Net positive on avg score."}
{"id": 90, "timestamp": "2026-03-27T05:00:00Z", "hypothesis": "Cycle 2 MACRO 2/10: Add pkg/ dir, rector.php, .properties to config detection", "type": "deterministic", "optimization_scope": "local", "changes": ["Added pkg/ and /pkg/brew/ to is_config_like_filename", "Added rector.php, phpstan.neon, phpunit.xml", "Added .properties extension check"], "avg_overall": 0.9561, "avg_overall_baseline": 0.9623, "delta": -0.0062, "repos_passing": 14, "repos_passing_baseline": 15, "decision": "revert", "notes": "MAJOR REGRESSION: 0.9623→0.9561, lost 1 PASS. The pkg/ directory check was too broad — 'pkg/' is used for Go source packages (not just packaging). The .properties check caught Spring Boot's application.properties but that was already expected as infra in the golden (actually it's currently NOT in infra and the golden says it should be). Reverted all."}
{"id": 91, "timestamp": "2026-03-27T05:15:00Z", "hypothesis": "Cycle 2 MACRO 3/10: Add pkg/brew/ to config-like filenames for Homebrew formulas", "type": "deterministic", "optimization_scope": "local", "changes": ["Added pkg/brew/ to is_config_like_filename"], "avg_overall": 0.9626, "avg_overall_baseline": 0.9623, "delta": 0.0003, "repos_passing": 16, "repos_passing_baseline": 15, "decision": "keep", "notes": "ripgrep-recent: FAIL→PASS (perfect 1.00). Narrow fix after #90 regression showed broad pkg/ is unsafe."}
{"id": 92, "timestamp": "2026-03-27T05:30:00Z", "hypothesis": "Cycle 2 MACRO 4/10: Add rector.php, phpstan.neon, phpunit.xml to config-like filenames", "type": "deterministic", "optimization_scope": "local", "changes": ["Added PHP config tools to is_config_like_filename"], "avg_overall": 0.9630, "avg_overall_baseline": 0.9626, "delta": 0.0004, "repos_passing": 16, "per_repo_changes": {"laravel-recent": "0.96->0.98"}, "decision": "keep"}
{"id": 93, "timestamp": "2026-03-27T06:00:00Z", "hypothesis": "Cycle 2 MACRO 5/10: Add max merged group size to stem merge (tried 12, 20, 30)", "type": "deterministic", "optimization_scope": "global", "changes": ["Added merged_size check in merge_groups_by_stem"], "avg_overall_12": 0.9604, "avg_overall_20": 0.9616, "avg_overall_30": 0.9625, "avg_overall_baseline": 0.9630, "decision": "revert", "notes": "No threshold works — 12 too restrictive (lost PASS), 20/30 still slightly below baseline. The stem merge cascade is a fundamental tension: it helps test+impl pairs but over-merges in repos with many shared filenames (nushell, trpc, effect). The cascade comes from sequential merges, not single large merges. Would need a completely different approach (e.g., max iterations or stem uniqueness requirement)."}
{"id": 94, "timestamp": "2026-03-27T06:30:00Z", "hypothesis": "Cycle 2 MACRO 6/10: Cap stem merge iterations at 5/10 to prevent cascade", "type": "deterministic", "optimization_scope": "global", "changes": ["Added max_merges counter to merge_groups_by_stem"], "avg_overall": 0.9630, "avg_overall_baseline": 0.9630, "delta": 0.0, "repos_passing": 16, "decision": "revert", "notes": "NEUTRAL: cap doesn't help because cascade repos (effect, nushell, spring, trpc) start with only 1-3 groups. Even 2-3 merges collapse them to 1. The root cause is the zero-entrypoint path creating too few initial groups, not the stem merge being too aggressive. The stem merge is correct — it pairs tests with impls — but it operates on repos that already have too few groups to split."}
{"id": 95, "timestamp": "2026-03-27T07:00:00Z", "hypothesis": "ANALYSIS: Zero-entrypoint repos collapse to 1 group because consolidation merges all directory groups sharing a prefix. Stem merge is not the cause — zero-entrypoint path returns before step 6.", "type": "baseline", "optimization_scope": "global", "avg_overall": 0.9630, "repos_passing": 16, "decision": "analysis-only", "notes": "ROOT CAUSE FOUND: spring-petclinic, effect, nushell-testing all use zero-entrypoint path. Directory groups share deep common prefixes (e.g., src/main/java/org/.../owner/ and src/main/java/org/.../vet/). Consolidation at depth 6→0 merges them all. Fix would be: create more granular initial groups in zero-entrypoint path, or skip consolidation at shallow depths for repos with deep paths."}
{"id": 96, "timestamp": "2026-03-27T07:30:00Z", "hypothesis": "Cycle 2 MACRO 8/10: Guard zero-entrypoint consolidation — skip if it collapses to 1 group", "type": "deterministic", "optimization_scope": "global", "changes": ["Added consolidation guard in zero-entrypoint path"], "avg_overall": 0.9621, "avg_overall_baseline": 0.9630, "delta": -0.0009, "repos_passing": 16, "decision": "revert", "notes": "REGRESSION: -0.0009. The guard was correct but spring-petclinic/effect/nushell go through the BFS path (they have entrypoints), not zero-entrypoint. The 1-group issue is stem merge cascade in the BFS path. The zero-entrypoint guard doesn't help these repos. The 0.9630 score is the ceiling for the current algorithm without LLM refinement or import graph improvements."}
{"id": 97, "timestamp": "2026-03-27T08:00:00Z", "hypothesis": "PLATEAU CONFIRMED: 0.9630 on 57 repos across 12 languages. 5 consecutive experiments without improvement (#90, #93-96). Cycle 2 MACRO complete.", "type": "baseline", "optimization_scope": "global", "avg_overall": 0.9630, "repos_passing": 16, "repos_total": 57, "decision": "transition", "notes": "ROUND 2 CYCLE 2 COMPLETE. 96 experiments total. Session: 0.9538→0.9630 (+0.0092) across 45 experiments. Key wins: #64 stem merge (+0.0021), #72 zero-entrypoint fix (+0.0011), #89 Java/PHP test convention (+0.0007), #91 pkg/brew (+0.0003), #92 rector.php (+0.0004). Remaining failures: stem merge cascade (13 repos at 1 group), BFS-assigned infra files, cross-format same_group. All need LLM refinement or import graph. Next: continue GROWING_DATA to reach 77 repos, then Cycle 3 MACRO."}
{"id": 98, "timestamp": "2026-03-27T08:30:00Z", "hypothesis": "GROWING_DATA: Add Redis C repo (27 files) — first C repo", "type": "corpus-expansion", "avg_overall": 0.9598, "repos_total": 58, "repos_passing": 16, "new_repo_score": 0.78, "decision": "keep", "notes": "First C repo. Scores 0.78 — low because C tree-sitter doesn't detect entrypoints, so source files go to infra (70.4% infra ratio). Reveals C-specific gap in pipeline."}
{"id": 99, "timestamp": "2026-03-27T09:00:00Z", "hypothesis": "GROWING_DATA: Add Requests Python repo (15 files)", "type": "corpus-expansion", "avg_overall": 0.9580, "repos_total": 59, "repos_passing": 16, "new_repo_score": 0.85, "decision": "keep", "notes": "Requests HTTP library. docs .rst files BFS-assigned to groups. Same pattern as other repos with BFS-reachable infra."}
{"id": 100, "timestamp": "2026-03-27T09:15:00Z", "hypothesis": "GROWING_DATA: Experiment #100! Add chi Go repo (23 files)", "type": "corpus-expansion", "avg_overall": 0.9587, "repos_total": 60, "repos_passing": 17, "new_repo_score": 1.00, "decision": "keep", "notes": "100TH EXPERIMENT! Perfect score on chi. 60 repos, 17 PASS (30%). Go repos consistently score well — strong tree-sitter + entrypoint detection. 17 more repos to reach 77."}
{"id": 101, "timestamp": "2026-03-27T09:30:00Z", "hypothesis": "GROWING_DATA: Add Pingora Rust repo (23 files)", "type": "corpus-expansion", "avg_overall": 0.9587, "repos_total": 61, "repos_passing": 17, "new_repo_score": 0.97, "decision": "keep"}
{"id": 102, "timestamp": "2026-03-27T10:00:00Z", "hypothesis": "GROWING_DATA: Vercel AI SDK (75 files) — classification in progress", "type": "corpus-expansion", "avg_overall": 0.9587, "repos_total": 61, "decision": "in-progress", "notes": "Sub-agent classifying 75 files. Will be committed in next session."}
{"id": 102, "timestamp": "2026-03-27T10:30:00Z", "hypothesis": "GROWING_DATA: Add Vercel AI SDK (75 files)", "type": "corpus-expansion", "avg_overall": 0.9594, "repos_total": 62, "repos_passing": 17, "new_repo_score": 0.99, "decision": "keep", "notes": "Vercel AI SDK scores 0.99. Sub-agent golden generation. 62 repos, 15 more to 77."}
{"id": 103, "timestamp": "2026-03-27T10:45:00Z", "hypothesis": "GROWING_DATA: Add pydantic-settings Python repo (13 files)", "type": "corpus-expansion", "avg_overall": 0.9597, "repos_total": 63, "repos_passing": 17, "new_repo_score": 0.98, "decision": "keep"}
{"id": 104, "timestamp": "2026-03-27T11:00:00Z", "hypothesis": "GROWING_DATA: Add gorilla-mux Go repo (8 files)", "type": "corpus-expansion", "avg_overall": 0.9598, "repos_total": 64, "repos_passing": 17, "new_repo_score": 0.97, "decision": "keep", "notes": "Stem merge cascade collapses all 4 test+impl groups to 1. Another data point for the cascade problem."}
{"id": 105, "timestamp": "2026-03-27T11:30:00Z", "hypothesis": "GROWING_DATA: Add Tauri Rust repo (75 files)", "type": "corpus-expansion", "avg_overall": 0.9598, "repos_total": 65, "repos_passing": 17, "new_repo_score": 0.96, "decision": "keep"}
{"id": 106, "timestamp": "2026-03-27T12:00:00Z", "hypothesis": "GROWING_DATA: Add Rye Rust repo (19 files)", "type": "corpus-expansion", "avg_overall": 0.9595, "repos_total": 66, "repos_passing": 17, "new_repo_score": 0.94, "decision": "keep"}
{"id": 107, "timestamp": "2026-03-27T12:30:00Z", "hypothesis": "GROWING_DATA: Add Svelte TS repo (77 files)", "type": "corpus-expansion", "avg_overall": 0.9594, "repos_total": 67, "repos_passing": 17, "new_repo_score": 0.95, "decision": "keep"}
