{"id": 47, "timestamp": "2026-03-27T06:15:00Z", "hypothesis": "SESSION SUMMARY: 47 experiments across ~12 hours. Deterministic heuristics plateaued at avg_overall=0.95 on 47 repos (11 PASS). Ready for Phase 3 (LLM refinement) or embeddings.", "type": "baseline", "optimization_scope": "global", "avg_overall": 0.9500, "repos_passing": 11, "repos_total": 47, "decision": "session-end", "notes": "FULL SESSION SUMMARY:\n- Round 1: 0.82→0.98 on 17 repos (36 experiments)\n- Corpus expansion: 17→47 repos with sub-agent goldens\n- Round 2: 0.91→0.95 on 47 repos (11 experiments)\n- Key algorithm changes: Rust entrypoints, consolidation, rescue, test-impl coalescing, zero-entrypoint groups\n- Infrastructure: lint-goldens CLI, per-repo TOMLs, GROWING_DATA/OPTIMISING state machine, LOCAL/GLOBAL tracking\n- Rules: frozen goldens, no scripts, 500-file cap, expand before optimize\n- GLOBAL wins delivered 5-10x more impact than LOCAL wins\n- Deterministic ceiling confirmed: remaining gap is semantic (needs LLM/embeddings)"}
{"id": 50, "timestamp": "2026-03-27T06:30:00Z", "hypothesis": "CONFIRMED PLATEAU: All remaining failures are semantic (BFS-reachable files with trivial changes, cross-directory test+impl, docs content vs docs infra). Deterministic heuristics cannot distinguish these. Phase 3 (LLM refinement) is the mandatory next step.", "type": "baseline", "optimization_scope": "global", "avg_overall": 0.9500, "repos_passing": 11, "repos_total": 47, "decision": "plateau-confirmed", "notes": "50 experiments completed. Deterministic: 0.82→0.95. Remaining 5% gap requires semantic understanding: LLM refinement, embeddings, or import graph via LSP. The /research loop should now focus on Phase 3 experiments from human-experiment-ideas-for-later.md."}
{"id": 51, "timestamp": "2026-03-27T06:45:00Z", "hypothesis": "Phase 3: Test LLM refinement on rich-recent with claude-sonnet-4-6", "type": "llm", "optimization_scope": "global", "model": "claude-sonnet-4-6", "avg_overall": 0.9500, "baseline_comparison": "N/A — refinement silently skipped (no API key)", "decision": "blocked", "notes": "BLOCKER: ANTHROPIC_API_KEY and OPENAI_API_KEY not set. LLM refinement requires API keys. The --refine flag exists and the CLI accepts it, but the refinement is silently skipped when no key is available. To unblock Phase 3: set ANTHROPIC_API_KEY via 1Password (op://octospark-services/anthropic-api-key/credential) or similar."}
{"id": 52, "timestamp": "2026-03-27T07:30:00Z", "hypothesis": "Add Rust-native code embeddings via fastembed crate (Jina Code v2, 768d, 30 languages) for semantic file similarity — GLOBAL approach to complement tree-sitter graph", "type": "deterministic", "optimization_scope": "global", "changes": ["Added fastembed = 4 as optional dep behind 'embeddings' feature flag", "Created embeddings.rs module with embed_file_diffs(), cosine_similarity(), pairwise_similarities(), cluster_by_similarity()", "Added embed-diff CLI subcommand for experimentation", "7 unit tests for cosine_similarity and clustering"], "avg_overall": 0.9500, "delta": 0.0, "decision": "keep", "notes": "Infrastructure experiment — no eval score change yet (embeddings not integrated into cluster.rs pipeline). Validated on rich-recent: correctly identified cells.py<->test_cells.py as top pair (0.852). Validated on cobra-recent: correctly identified bash_completionsV2.go<->fish_completions.go (0.758). Next: integrate embedding similarity as a signal in cluster.rs merge decisions."}
{"id": 53, "timestamp": "2026-03-27T09:30:00Z", "hypothesis": "Centroid-based embedding refinement: rescue infra files with cosine similarity >= 0.70 to nearest group centroid, merge small groups with centroid similarity >= 0.75", "type": "deterministic", "optimization_scope": "global", "changes": ["refine_with_embeddings() with centroid approach (O(infra*groups) not O(n^2))", "Batched ONNX inference (64/batch) to fix 62GB memory blowup", "UTF-8 char boundary fix for truncation"], "avg_overall": 0.94, "avg_overall_baseline": 0.95, "delta": -0.01, "decision": "revert", "notes": "REGRESSION: 0.95 -> 0.94. Embedding rescue threshold 0.70 too low — pulled config files (README.md, Cargo.toml, build.rs, CHANGELOG.md) out of infra because they have moderate embedding similarity to source code. deno: 0.99->0.85 (worst). Infra files are NOT low-similarity — they're written in the same language and share vocabulary with source code. Need either: (a) much higher threshold (0.85+), (b) only rescue files already flagged by extension-based heuristics, (c) use embeddings only for group merging not infra rescue. Kept: batched inference + UTF-8 fix. Reverted: refine_with_embeddings integration + eval wiring."}
{"id": 54, "timestamp": "2026-03-27T10:15:00Z", "hypothesis": "Merge-only embedding refinement: skip infra rescue (caused regression in #53), only merge small groups with centroid similarity >= 0.75", "type": "deterministic", "optimization_scope": "global", "changes": ["Removed infra rescue step entirely", "Centroid-based group merging: O(groups^2 * dim)", "Reused cached embeddings from #53 — eval ran in 13s"], "avg_overall": 0.95, "avg_overall_baseline": 0.95, "delta": 0.0, "repos_passing": 11, "decision": "keep", "notes": "NEUTRAL: 0.95 unchanged, 11 PASS same as baseline. Merge-only approach doesn't regress (safe) but also doesn't improve — the existing consolidate_small_groups() directory-based merging already handles the cases embedding merging would catch. Groups in the same directory get merged before embeddings run. Next: try lower merge threshold (0.60), or use embeddings for cross-directory merging only (skip groups that already share a directory prefix)."}
{"id": 55, "timestamp": "2026-03-27T10:45:00Z", "hypothesis": "Cross-directory embedding merge at threshold 0.60 — only merge groups that don't share a top-level directory, since consolidate_small_groups already handles same-directory merges", "type": "deterministic", "optimization_scope": "global", "changes": ["Lowered threshold to 0.60", "Added groups_share_directory() check to skip same-directory pairs", "Only targets cross-directory group pairs"], "avg_overall": 0.95, "avg_overall_baseline": 0.95, "delta": 0.0, "repos_passing": 11, "decision": "revert", "notes": "NEUTRAL: 0.95 unchanged. Changed some group counts (cobra 3->1, caddy 3->2) but didn't fix any golden failures. KEY INSIGHT: remaining same_group failures are cross-format (e.g., .md test file + .rs implementation) — full-file-content embeddings show LOW similarity between different languages/formats even when they're logically related. Embedding DIFF HUNKS might work better — what changed is more relevant than what the file contains. Or: the remaining 5% gap genuinely requires understanding the repo's test conventions (mdtest -> builder mapping in ruff), which is beyond what unsupervised embeddings can do — needs LLM refinement."}
{"id": 56, "timestamp": "2026-03-27T11:00:00Z", "hypothesis": "Demote package manager configs (package.json, tsconfig.json, Cargo.toml, etc.) from groups back to infrastructure after BFS assignment", "type": "deterministic", "optimization_scope": "local", "changes": ["Added should_demote_from_group() with 20+ package manager filenames", "Step 5.5 after consolidation: move BFS-assigned PM configs back to infra"], "avg_overall": 0.95, "avg_overall_baseline": 0.95, "delta": 0.0, "repos_passing": 10, "repos_passing_baseline": 11, "decision": "revert", "notes": "NET NEGATIVE: lost payload-eval-suite PASS (package.json files in that repo's goldens are marked as non_infrastructure — they're part of test fixture packages that are meaningful feature changes). Blanket demotion of package.json is wrong — some package.json files ARE feature code (test fixtures, new packages). Would need per-context heuristic (e.g., only demote if in monorepo root or if file is unchanged/trivial). Too complex for a LOCAL heuristic."}
{"id": 57, "timestamp": "2026-03-27T11:30:00Z", "hypothesis": "Coalesce test files from infra into groups (step 5.5) — if a test file is in infra but its implementation is in a group, move it there", "type": "deterministic", "optimization_scope": "global", "changes": ["Added step 5.5 after consolidation: scan infra for test files, stem-match to group impls, move if found"], "avg_overall": 0.95, "avg_overall_baseline": 0.95, "delta": 0.0, "repos_passing": 11, "decision": "keep", "notes": "NEUTRAL: 0.95 unchanged. The specific echo-recent case (httperror.go/httperror_test.go) didn't improve because both files are likely root-level and already in the same directory group or both in infra. The coalescing step is safe (no regressions) and will help future repos where tests are unreachable but their impls are in groups."}
{"id": 58, "timestamp": "2026-03-27T12:00:00Z", "hypothesis": "Analysis: identify easiest wins among failing repos. Found 5 repos with golden score >= 0.99 that FAIL on thresholds or single constraints", "type": "baseline", "optimization_scope": "global", "avg_overall": 0.95, "decision": "analysis-only", "notes": "ANALYSIS SESSION — no code change. Findings: (1) calcom-large-range FAIL because 33 groups > max 30 — golden constraint too tight. (2) scrapy FAIL because tests/utils/__init__.py in infra (is_config_like_filename) but golden expects it in group. (3) hugo-css-build scores 0.58 because docs/content/ classified as Documentation infra but is feature content for a static site generator. (4) octospark 1894 non-infra failures = 90% of total but only 0.79 score — pattern-classified golden. KEY INSIGHT: many 'failures' are golden constraints that are debatable or golden thresholds that are too tight, not algorithm bugs. The 0.95 score is arguably the correct ceiling for deterministic heuristics — the remaining 5% is genuinely ambiguous classification that requires semantic understanding."}
{"id": 59, "timestamp": "2026-03-27T12:30:00Z", "hypothesis": "Exempt top-level docs/content/ and www/docs/ from Documentation classification — static site generators treat these as feature content", "type": "deterministic", "optimization_scope": "local", "changes": ["Added is_site_content check: lower.starts_with('docs/content/') || lower.starts_with('www/docs/')", "Only top-level paths exempted — packages/docs/content/ still classified as Documentation"], "avg_overall": 0.9545, "avg_overall_baseline": 0.9538, "delta": 0.0007, "repos_passing": 11, "per_repo_changes": {"hugo-css-build": "0.58 -> 0.98 (+0.40)", "trpc-recent": "0.96 -> 0.99 (+0.03)"}, "decision": "keep", "notes": "FIRST IMPROVEMENT BEYOND 0.95 PLATEAU! Hugo was the worst-scoring repo (0.58) due to 147 docs/content/ files classified as Documentation infra. Now correctly classified as source content. No regressions (zod PASS maintained by narrowing to top-level paths only)."}
{"id": 60, "timestamp": "2026-03-27T13:00:00Z", "hypothesis": "Only classify .md files as Documentation at root level or in docs/ directories — inline .md in src/ trees should stay with source code", "type": "deterministic", "optimization_scope": "local", "changes": ["Changed .md extension match to only catch root-level files (no / in path)", "Kept docs/ directory classification unchanged"], "avg_overall": 0.9483, "avg_overall_baseline": 0.9545, "delta": -0.0062, "repos_passing": 8, "repos_passing_baseline": 11, "decision": "revert", "notes": "REGRESSION: 0.9545 -> 0.9483, lost 3 PASS repos. The .md extension classifier is load-bearing — many CHANGELOG.md, README.md files in nested directories rely on it for correct infra classification. The 5 axum src/docs/*.md files that would benefit are far outweighed by the damage. Cannot remove .md as global documentation marker."}
{"id": 61, "timestamp": "2026-03-27T13:30:00Z", "hypothesis": "Exempt .md files inside src/docs/ and resources/mdtest/ from Documentation classification — these are inline API docs and test specs tied to source code", "type": "deterministic", "optimization_scope": "local", "changes": ["Added is_inline_doc check: /src/docs/ or /resources/mdtest/ paths with .md/.mdx extension", "Narrower than #60 (which tried all src/) — only src/docs/ and resources/mdtest/"], "avg_overall": 0.9549, "avg_overall_baseline": 0.9545, "delta": 0.0004, "repos_passing": 11, "per_repo_changes": {"axum-refactor": "0.97 -> 0.99 (+0.02, 5 inline docs fixed)"}, "decision": "keep", "notes": "IMPROVEMENT: 0.9545 -> 0.9549. axum-refactor golden improved from 0.93 to 0.98 (5 src/docs/*.md files now correctly in groups). First attempt (#60) was too broad (all src/), lost 3 PASS repos. This narrower version (src/docs/ only) avoids regressions. Consecutive LOCAL wins: #59 (docs/content) + #61 (src/docs)."}
{"id": 62, "timestamp": "2026-03-27T15:30:00Z", "hypothesis": "MACRO #1: Diff-based embeddings — embed change hunks (added/removed lines) instead of full file content. Files with similar changes cluster together even if content differs.", "type": "deterministic", "optimization_scope": "global", "changes": ["Added compute_diff_text() in repos.rs: extracts added lines from old→new content", "Changed eval pipeline to pass diff text to embed_file_diffs instead of full content", "New cache entries (~6500) for diff-based embeddings"], "avg_overall": 0.9551, "avg_overall_baseline": 0.9549, "delta": 0.0002, "decision": "keep", "notes": "MARGINAL IMPROVEMENT: 0.9549 -> 0.9551 (+0.0002). Cold run took 38 min (13K new cache entries). Diff-based embeddings don't significantly outperform full-content for merging small groups — the centroid-based merge at 0.75 threshold barely triggers with either input. The diff text captures change semantics but the merge-only refinement doesn't leverage it well. Future: could use diff embeddings for infra classification (diff of config change looks very different from diff of feature code)."}
{"id": 63, "timestamp": "2026-03-27T16:00:00Z", "hypothesis": "MACRO 2/10: Bare-stem matching for test-impl coalescing — match files across directories by lowercased filename without extension/test suffixes", "type": "deterministic", "optimization_scope": "global", "changes": ["Added bare_stem() function: strips dir, test suffix, extension, lowercases", "Used bare_stem in both BFS coalescing (step 3.5) and infra coalescing (step 5.5)"], "avg_overall": 0.9549, "avg_overall_baseline": 0.9549, "delta": 0.0, "repos_passing": 11, "decision": "revert", "notes": "NEUTRAL: 50 same_group failures unchanged. The bare-stem matching correctly computes matching stems (e.g., Cron.ts -> 'cron', Cron.test.ts -> 'cron') but the test files are already in different BFS groups (not in infra), and the BFS coalescing condition requires impl_grp != ep_idx — if both are already assigned to the same group, no move happens. Need to investigate: are the Effect.ts files in the SAME group but the eval says they're not? Or are they in different groups and the move condition fails?"}
{"id": 64, "timestamp": "2026-03-27T16:30:00Z", "hypothesis": "MACRO 3/10: Post-consolidation cross-group merge by bare stem — merge groups that share test+impl file pairs by lowercased filename stem", "type": "deterministic", "optimization_scope": "global", "changes": ["Added merge_groups_by_stem() as step 6 after infra construction", "Added bare_stem() helper: strips dir, test suffix, extension, lowercases", "Iterative merge: finds best test+impl stem match, merges smaller into larger"], "avg_overall": 0.9570, "avg_overall_baseline": 0.9549, "delta": 0.0021, "repos_passing": 12, "repos_passing_baseline": 11, "same_group_failures": 37, "same_group_failures_baseline": 50, "per_repo_changes": {"scrapy-features": "FAIL->PASS (same_group fixed)", "effect-recent": "0.94->0.96 (Cron test+impl merged)", "echo-recent": "0.79->0.84 (httperror test+impl merged)"}, "decision": "keep", "notes": "BEST EXPERIMENT THIS SESSION. +0.0021 avg, +1 PASS, -13 same_group failures. Post-consolidation stem merge catches test+impl pairs that BFS puts in different groups. Works for monorepo patterns (packages/X/src/ vs packages/X/test/), same-directory pairs, and cross-directory pairs with matching filename stems."}
{"id": 65, "timestamp": "2026-03-27T17:00:00Z", "hypothesis": "MACRO 4/10: Add .vitest. test suffix to stem matching — handles Prisma-style test files (Studio.vitest.ts)", "type": "deterministic", "optimization_scope": "global", "changes": ["Added .vitest. to is_test_file_name, test_impl_stem, bare_stem"], "avg_overall": 0.9572, "avg_overall_baseline": 0.9570, "delta": 0.0002, "repos_passing": 12, "same_group_failures": 35, "same_group_failures_baseline": 37, "decision": "keep", "notes": "Fixed 2 Prisma same_group failures: Studio.vitest.ts ↔ Studio.ts, Link.vitest.ts ↔ Link.ts. Small but clean improvement with no regressions."}
{"id": 66, "timestamp": "2026-03-27T17:30:00Z", "hypothesis": "MACRO 5/10: Add .changeset/, version files, zz_generated to infrastructure detection", "type": "deterministic", "optimization_scope": "local", "changes": [".changeset/ → Infrastructure", "version.go/ts/js/py/rb → is_config_like_filename", "zz_generated* → is_config_like_filename"], "avg_overall": 0.9581, "avg_overall_baseline": 0.9572, "delta": 0.0009, "repos_passing": 12, "per_repo_changes": {"echo-recent": "0.84->0.89", "effect-recent": "0.96->0.97", "kubectl-features": "0.94->0.95"}, "decision": "keep", "notes": "Targeted 5 infrastructure failures. All fixed with no regressions. Technically LOCAL heuristics but filed under current MACRO phase since they were identified during MACRO analysis."}
{"id": 67, "timestamp": "2026-03-27T18:00:00Z", "hypothesis": "MACRO 6/10: Merge groups sharing a monorepo package prefix (2-level dir prefix like packages/X/)", "type": "deterministic", "optimization_scope": "global", "changes": ["Added merge_groups_by_package_prefix() as step 7", "Merges groups where files share 2-level directory prefix"], "avg_overall": 0.9579, "avg_overall_baseline": 0.9581, "delta": -0.0002, "repos_passing": 11, "repos_passing_baseline": 12, "same_group_failures": 34, "decision": "revert", "notes": "REGRESSION: lost zod-recent PASS. Package prefix merge too aggressive — merges packages that should be separate in monorepos (different packages under packages/ are intentionally distinct). Fixed 3 same_group (34 vs 37) but lost 1 PASS. Net negative."}
{"id": 68, "timestamp": "2026-03-27T18:30:00Z", "hypothesis": "MACRO 7/10: Merge small groups sharing same parent directory in stem merge step — catches module-level splits", "type": "deterministic", "optimization_scope": "global", "changes": ["Extended merge_groups_by_stem to merge groups where files share full parent dir", "Only merges groups <= SMALL_GROUP_THRESHOLD files"], "avg_overall": 0.9589, "avg_overall_baseline": 0.9581, "delta": 0.0008, "repos_passing": 12, "same_group_failures": 33, "same_group_failures_baseline": 35, "decision": "keep", "notes": "Fixed 2 same_group failures where files in the same directory (e.g., modules/httplib/) ended up in different BFS groups. Conservative (only small groups), no regressions."}
{"id": 69, "timestamp": "2026-03-27T19:00:00Z", "hypothesis": "MACRO 8/10: Relax directory merge threshold to 2x SMALL_GROUP_THRESHOLD (10) for post-consolidation merge step", "type": "deterministic", "optimization_scope": "global", "changes": ["Changed dir_merge_threshold from SMALL_GROUP_THRESHOLD (5) to SMALL_GROUP_THRESHOLD * 2 (10)"], "avg_overall": 0.9581, "avg_overall_baseline": 0.9589, "delta": -0.0008, "repos_passing": 11, "repos_passing_baseline": 12, "same_group_failures": 32, "decision": "revert", "notes": "REGRESSION: lost zod-recent PASS. Same pattern as #67 — relaxing merge thresholds causes over-merging in monorepos where packages in the same directory should be separate. The SMALL_GROUP_THRESHOLD of 5 is well-calibrated. Remaining 33 same_group failures need fundamentally different signals (LLM, framework conventions), not threshold tuning."}
{"id": 70, "timestamp": "2026-03-27T19:30:00Z", "hypothesis": "MACRO 9/10: Add testscripts/, testdata/, specs/ to test directory detection for bare-stem matching", "type": "deterministic", "optimization_scope": "global", "changes": ["Added /testscripts/, /testdata/, /specs/ to is_test_file_name directory patterns"], "avg_overall": 0.9589, "avg_overall_baseline": 0.9589, "delta": 0.0, "repos_passing": 12, "same_group_failures": 33, "decision": "keep", "notes": "NEUTRAL: no score change. Files in these directories are already in groups (not misclassified) — the issue is they end up in different groups. But the test directory detection is a correctness improvement that will help future repos with these conventions."}
{"id": 71, "timestamp": "2026-03-27T20:00:00Z", "hypothesis": "MACRO 10/10 (final): Exclude common infra stems (package, changelog, index, readme, etc.) from bare-stem matching to prevent cascade-merging in monorepos", "type": "deterministic", "optimization_scope": "global", "changes": ["Added exclusion list in bare_stem(): returns empty for common infra filenames", "14 excluded stems: package, changelog, readme, license, index, mod, lib, main, init, __init__, version, setup, config, tsconfig"], "avg_overall": 0.9589, "avg_overall_baseline": 0.9589, "delta": 0.0, "repos_passing": 12, "same_group_failures": 33, "decision": "keep", "notes": "NEUTRAL: no score change on current corpus. But prevents cascade-merging for future monorepo additions (37 package.json files in effect-recent would have merged all groups without this). Effect-recent still 1 group because it has no/few entrypoints, not because of stem merging. MACRO PHASE COMPLETE: 10/10 experiments done. Results: +0.0051 net, 4 significant improvements (#59 docs, #64 stem merge, #66 infra, #68 dir merge). Transitioning to MICRO phase."}
