{"id": 156, "timestamp": "2026-03-27T17:35:24Z", "hypothesis": "Round 4 MICRO 4/10: limit root-doc batch fallback rescue to direct docs/<page> files so nested docs trees stop being treated as top-level documentation pages", "type": "deterministic", "optimization_scope": "local", "changes": ["temporarily tightened root docs detection in cluster/rescue.rs so docs batch-context fallback only applied to direct docs/<file> paths", "added a focused unit assertion that docs/user/advanced.rst is not treated as a root docs page"], "avg_overall": 0.96648339512229, "avg_overall_baseline": 0.9662984320823893, "avg_golden": 0.9323978422756338, "avg_golden_baseline": 0.9275106753476549, "delta": 0.00018496303990068078, "repos_total": 107, "repos_passing": 28, "repos_passing_baseline": 27, "min_overall": 0.6699999999999999, "min_overall_baseline": 0.8055555555555556, "per_repo_changes": {"black-recent": "0.8971->0.9771", "okhttp-android-api-docs": "0.8500->0.9250", "django-recent": "0.8210->0.8824", "django-streaming-mail-oracle": "0.8526->0.8947", "sqlmodel-recent": "0.8600->0.6700", "httpx-recent": "0.9765->0.9294"}, "decision": "discard", "notes": "STATE: OPTIMISING (107 targets). The narrower docs fallback fixed the intended over-rescue pattern in Black, both Django targets, Rye, Scrapy, and OkHttp docs, lifting avg overall, avg golden, and repos passing. But it failed the regression gate: sqlmodel-recent regressed by 0.19 overall (0.8600->0.6700) and httpx-recent also fell by 0.0471, which means some doc-heavy targets still rely on the broader fallback to keep their semantic tutorial/docs bundles together. Because the workspace already had unrelated dirty changes and the touched file was already modified, I did not make a git commit for this experiment; I reverse-applied only this patch and confirmed the reverted eval returned exactly to the saved baseline metrics."}
{"id": 157, "timestamp": "2026-03-27T17:43:08Z", "hypothesis": "Round 4 MICRO 5/10: keep docs batch rescue narrow by treating only direct docs/<page> paths as root docs pages, but preserve semantic fallback for docs/tutorial/ and docs/advanced/", "type": "deterministic", "optimization_scope": "local", "changes": ["tightened root docs detection in cluster/rescue.rs so nested docs/* trees no longer count as root docs batch pages", "preserved semantic fallback for docs/tutorial/* and docs/advanced/* to avoid the sqlmodel/httpx regressions from #156", "added focused rescue tests covering nested docs trees and semantic tutorial/advanced fallback"], "avg_overall": 0.9688836150233345, "avg_overall_baseline": 0.9662984320823893, "avg_golden": 0.934893719131049, "avg_golden_baseline": 0.9275106753476549, "delta": 0.00258518294094523, "repos_total": 107, "repos_passing": 28, "repos_passing_baseline": 27, "min_overall": 0.8055555555555556, "min_repo": "boto3-recent", "per_repo_changes": {"black-recent": "0.8971->0.9771", "okhttp-android-api-docs": "0.8500->0.9250", "django-recent": "0.8210->0.8824", "django-streaming-mail-oracle": "0.8526->0.8947", "sqlmodel-recent": "0.8600->0.9000", "scrapy-features": "0.9731->1.0000 (FAIL->PASS)", "httpx-028-verify-cert-python313": "0.9200->0.8880"}, "decision": "keep", "notes": "STATE: OPTIMISING (107 targets). This repaired the over-broad docs rescue from #156 without reintroducing the sqlmodel/httpx regressions: nested infra docs trees in Black, Django, and OkHttp stay in infrastructure, while semantic tutorial/advanced docs still get a fallback attachment. Avg overall and avg golden both improved materially, passes increased 27->28, and no repo regressed by more than 0.05. A clean experiment commit was not possible because crates/diffcore-core/src/cluster/rescue.rs already had pre-existing uncommitted changes in the dirty worktree, so the kept delta remains only in the working tree."}
{"id": 158, "timestamp": "2026-03-27T18:00:11Z", "hypothesis": "Round 4 MICRO 6/10: make the no-entrypoint fallback keep generic docs/release/admin metadata in infrastructure instead of promoting them into semantic directory groups", "type": "deterministic", "optimization_scope": "global", "changes": ["temporarily made the no-entrypoint soft-infra path use semantic-doc gating instead of rescuing all documentation by extension", "temporarily treated CODEOWNERS and __version__.py as infra/config-like metadata in that path", "added focused no-entrypoint tests for generic docs/release metadata vs semantic tutorial docs"], "avg_overall": 0.965014095656265, "avg_overall_baseline": 0.9688836150233345, "avg_golden": 0.936857232000219, "avg_golden_baseline": 0.934893719131049, "delta": -0.003869519367069511, "repos_total": 107, "repos_passing": 27, "repos_passing_baseline": 28, "min_overall": 0.6357142857142857, "min_overall_baseline": 0.8055555555555556, "per_repo_changes": {"requests-recent": "0.8737->0.9500", "boto3-recent": "0.8056->0.8500", "httpx-028-verify-cert-python313": "0.8880->0.9040", "ruff-recent": "0.9385->0.9692", "uv-recent": "0.9623->0.9723", "fiber-recent": "1.0000->0.6357", "react-router-recent": "0.9652->0.7379"}, "decision": "discard", "notes": "STATE: OPTIMISING (107 targets). This did exactly what it was meant to for Requests/Boto3-style no-entrypoint ranges: Requests golden jumped 0.6842->1.0000 and Boto3 golden 0.8889->1.0000, with smaller wins on HTTPX, Ruff, and uv. But the heuristic was too broad in the other direction and failed the regression gate hard: fiber-recent fell by 0.3643 overall and react-router-recent fell by 0.2273, dropping repos passing 28->27 and avg overall 0.9689->0.9650 even though avg golden ticked up. Because the touched files already had unrelated worktree changes, no clean experiment commit was possible; I reverse-applied only this patch and confirmed a fresh post-revert eval returned exactly to the saved baseline metrics."}
{"id": 159, "timestamp": "2026-03-27T18:12:53Z", "hypothesis": "Round 4 MICRO 7/10: classify release/admin metadata files (CODEOWNERS, __version__.py, root CHANGELOG.rst) as infrastructure so Python release churn stops leaking into semantic groups", "type": "deterministic", "optimization_scope": "local", "changes": ["classified CODEOWNERS as true infrastructure metadata", "treated __version__.py like other version constant files", "recognized root CHANGELOG.rst as a top-level release doc", "added a focused cluster classification test for those release/admin metadata patterns"], "avg_overall": 0.9698420235055994, "avg_overall_baseline": 0.9688836150233345, "avg_golden": 0.9372897403367109, "avg_golden_baseline": 0.934893719131049, "delta": 0.0009584084822649164, "repos_total": 107, "repos_passing": 28, "repos_passing_baseline": 28, "min_overall": 0.85, "min_overall_baseline": 0.8055555555555556, "min_repo": "boto3-recent", "per_repo_changes": {"boto3-recent": "0.8056->0.8500", "requests-recent": "0.8737->0.9158", "httpx-028-verify-cert-python313": "0.8880->0.9040"}, "decision": "keep", "notes": "STATE: OPTIMISING (107 targets). Narrow metadata-only heuristic: boto3 now fully satisfies goldens, Requests clears the CODEOWNERS/__version__.py infra misses, and HTTPX picks up the __version__.py infra classification. No repo regressed. A clean experiment commit was not possible because both touched source files already had unrelated uncommitted changes in the dirty worktree, so the kept delta remains in the working tree."}
